{
    "slot": 1,
    "multi_set_enabled": true,
    "timeout": 100,
    "detail": "SUBSCRIPTIONS",
    "params": {
        "descriptors": [
            {
                "basic_param_info": {
                    "oid": "hello",
                    "name": {
                        "monoglot": "Greeting"
                    },
                    "type": {
                        "param_type": "FLOAT32"
                    }
                },
                "value": {
                    "float32_value": 0.1
                }
            }
        ]
    }
}



  